{
  "schema_version": "showcase.run-status.v1",
  "request_id": "6d02ac20-f1b8-40f8-88d7-a9e67b4185aa",
  "phase": "SPARK_RUNNING",
  "observed_at": "2026-10-27T20:00:30Z",
  "data_origin": "MOCK",
  "last_successful_snapshot_id": "snapshot-mock-atlanta-001",
  "public_message": "MOCK ONLY — illustrative state, no real Spark job was started."
}
